{
  "specversion": "1.0",
  "id": "traffic_demo_joint_static_v2",
  "source": "urn:edge:traffic_edge_a:external-traffic-model",
  "type": "com.cloudedge.traffic.edge-event.v1",
  "scene": "freeway_traffic_management",
  "edgeid": "traffic_edge_a",
  "subject": "joint_static_v2_smoke_001",
  "time": "2026-07-29T00:00:00Z",
  "datacontenttype": "application/json",
  "dataschema": "https://cloud-edge.local/schemas/scenes/traffic-edge-event-v1.json",
  "data": {
    "sample_id": "joint_static_v2_smoke_001",
    "sample_split": "demo",
    "dataset": "portable_traffic",
    "region_id": "region_a",
    "shared_resource": "corridor:I-5-demo",
    "prediction_horizon_minutes": 60,
    "managed_node_ids": [5, 9, 26],
    "region_summary": {
      "region_risk_level": "severe",
      "region_risk_score": 0.94,
      "region_risk_confidence": 0.92,
      "region_risk_probabilities": {
        "low": 0.01,
        "medium": 0.02,
        "high": 0.05,
        "severe": 0.92
      },
      "region_risk_calibration": {
        "method": "portable_demo",
        "calibrated_confidence": 0.92,
        "prediction_set": ["severe"]
      },
      "congestion_cluster_detected": true
    },
    "top_k_risk_nodes": [
      {
        "node_id": 9,
        "risk_level": "severe",
        "risk_score": 0.96,
        "risk_confidence": 0.94,
        "forecast": {"speed_mean": 24, "flow_mean": 650}
      }
    ],
    "control_capabilities": {
      "variable_speed_limit_nodes": [5, 9, 26],
      "ramp_meter_nodes": []
    },
    "aggregation": {
      "member": "edge_a",
      "expected_members": ["edge_a", "edge_b"],
      "minimum_members": 1,
      "timeout_ms": 300
    },
    "deadline_ms": 200,
    "preprocessing_latency_ms": 3.2,
    "inference_latency_ms": 36.0,
    "model": "portable_demo_external_input@1"
  }
}
